artigo,links_afiliados,status,categoria,palavras_chave,descricao,data_publicacao,autor
Poltrona Conforto Ergonômica,https://afiliado.com/poltrona,publicado,decoração,poltrona conforto ergonômica decoração,Review completo da Poltrona Conforto Ergonômica,2026-07-12,Equipe Top Ofertas
Mesa de Centro Design Moderno,https://afiliado.com/mesa,publicado,decoração,mesa centro design moderno,Análise detalhada da Mesa de Centro,2026-07-13,Equipe Top Ofertas
Luminária Pendente Industrial,https://afiliado.com/luminaria,publicado,decoração,luminária pendente industrial,Review da Luminária Pendente Industrial,2026-07-14,Equipe Top Ofertas
Tapete Persa Moderno,https://afiliado.com/tapete,publicado,decoração,tapete persa moderno decoração,Guia do Tapete Persa Moderno,2026-07-15,Equipe Top Ofertas
Estante Rústica 6 Prateleiras,https://afiliado.com/estante,publicado,decoração,estante rústica 6 prateleiras,Review da Estante Rústica,2026-07-16,Equipe Top Ofertas
Quadro Decorativo Abstrato,https://afiliado.com/quadro,publicado,decoração,quadro decorativo abstrato,Review do Quadro Decorativo,2026-07-17,Equipe Top Ofertas
testee Abstrato,https://afiliado.com/quadro,rascunho,quarto,quadro decorativo abstrato,Review do Quadro Decorativo,2026-07-17,Home Decor
